Wifi_hybrid_matrix_screening_lte_2g_sta5_50kb_seed6_th-58_h2_t30/wifi-hybrid-rssi_log_wifi_report.csv

metric,sta_index,node_id,sta_label,samples,max_db,max_time_s,min_db,min_time_s,mean_db
wifi_rssi,0,6,STA1,347,-52.7735,0.0670,-52.8780,29.9066,-52.8190
wifi_rssi,1,7,STA2,386,-47.3167,0.0613,-47.6209,29.9104,-47.4397
wifi_rssi,2,8,STA3,299,-49.8916,0.0537,-51.0705,29.9167,-50.4799
wifi_rssi,3,9,STA4,297,-52.2359,29.9167,-52.8047,0.0577,-52.4995
wifi_rssi,4,10,STA5,384,-51.4546,0.0633,-52.9150,29.9104,-52.1375

Wifi_hybrid_matrix_screening_lte_2g_sta5_50kb_seed6_th-58_h2_t30/wifi-hybrid-rssi_log_report.md

#### STA1 (sta_index=0, node_id=6)

- samples: 347
- max: -52.7735 at 0.0670 s
- min: -52.8780 at 29.9066 s
- mean: -52.8190
- wifi avg_rssi_dbm at max time: -52.7735

#### STA2 (sta_index=1, node_id=7)

- samples: 386
- max: -47.3167 at 0.0613 s
- min: -47.6209 at 29.9104 s
- mean: -47.4397
- wifi avg_rssi_dbm at max time: -47.3167

#### STA3 (sta_index=2, node_id=8)

- samples: 299
- max: -49.8916 at 0.0537 s
- min: -51.0705 at 29.9167 s
- mean: -50.4799
- wifi avg_rssi_dbm at max time: -49.8916

#### STA4 (sta_index=3, node_id=9)

- samples: 297
- max: -52.2359 at 29.9167 s
- min: -52.8047 at 0.0577 s
- mean: -52.4995
- wifi avg_rssi_dbm at max time: -52.2506

#### STA5 (sta_index=4, node_id=10)

- samples: 384
- max: -51.4546 at 0.0633 s
- min: -52.9150 at 29.9104 s
- mean: -52.1375
- wifi avg_rssi_dbm at max time: -51.4546